id_producto,nombre,descripcion,fecha_creacion,fecha_actualizacion,precio,cantidad_disponible
1,Multicolored LED Strip Lights,Flexible LED lights for creative home lighting designs.,2025-02-24,2025-07-11,29.99,7
1,Compact Umbrella,Portable and lightweight umbrella for protection from rain.,2025-02-23,2025-07-25,12.99,19
1,Scented Candles,Set of three aromatic candles with various scents.,2025-03-20,2025-09-26,19.99,10
1,Energy Protein Bars,Nutritious bars packed with protein for energy,2025-04-19,2025-07-02,2.29,36
1,Mango Chunks,Frozen mango chunks for smoothies or snacking.,2025-01-25,2025-09-07,4.89,53
1,Coconut Chia Pudding,Creamy chia pudding made with coconut milk and topped with mango.,2025-10-16,2025-10-07,3.49,53
1,Organic Lentil Soup,A hearty soup made with organic lentils and vegetables.,2025-09-03,2025-10-29,4.99,92
1,Marinara Parmesan Baked Ziti,Ziti pasta baked with marinara and parmesan cheese,2025-10-18,2025-09-07,8.49,23
1,Electric Wine Opener,Rechargeable electric wine opener for effortless uncorking.,2025-03-31,2025-09-22,29.99,63
1,Wireless Earbud Silicone Covers,Soft silicone earbud covers for comfort and fit.,2025-10-07,2025-08-11,9.99,86
1,Italian Sausage and Peppers,A flavorful blend of Italian sausage with sautéed peppers and onions.,2025-02-03,2025-08-21,8.99,68
1,Rice Noodles,"Thin rice noodles, ideal for stir-fries and soups.",2025-08-27,2025-07-30,3.49,1
1,Sweet Potato and Chickpea Bowl,A nourishing bowl of sweet potatoes and chickpeas with spices.,2024-12-23,2025-09-28,6.49,11
1,Frozen Berry Blend,A mix of frozen berries for smoothies or desserts,2025-05-15,2025-10-26,4.99,53
1,Coconut Bowls Set,Handmade eco-friendly bowls made from real coconuts.,2024-11-12,2025-11-03,22.99,7
1,Crispy Tofu Bites,,2025-04-19,2025-08-08,4.99,84
1,Canned Black Beans,"Delicious and hearty black beans, great for soups or salads.",2025-03-04,2025-09-01,1.29,46
1,Yoga Blocks,Set of two yoga blocks for increased stability and support.,2025-03-20,2025-07-25,29.99,83
1,Zesty Garlic Hummus,Creamy chickpea dip infused with zesty garlic flavor.,2024-12-29,2025-08-04,3.99,60
1,Cinnamon Sugar Tortilla Chips,"Crispy chips with a sweet twist, perfect for dipping.",2025-10-15,2025-07-28,3.29,65
1,Reusable Coffee Filter,Eco-friendly coffee filter for brewing.,2025-02-28,2025-10-25,10.99,11
1,Basmati Rice,"Aromatic long-grain basmati rice, perfect for curries.",2024-11-29,2025-07-25,5.79,89
1,Pepperoni Pizza Roll-Ups,"Savory pizza filled with pepperoni and cheese, ready to microwave.",2025-05-01,2025-09-24,5.99,82
1,Honey Mustard Chicken Breasts,Marinated chicken breasts coated in a sweet honey mustard glaze.,2025-05-18,2025-08-16,8.99,46
1,Smart Water Bottle with Hydration Reminder,Bottle that tracks your water intake and reminds you to drink.,2024-12-27,2025-07-25,39.99,44
1,Peach Salsa,Sweet and spicy salsa made with fresh peaches.,2025-05-19,2025-08-04,3.29,32
1,Smart Doorbell,Wi-Fi enabled doorbell with HD camera and two-way audio.,2025-04-13,2025-09-23,119.99,70
1,Vegan Taco Seasoning,Spice blend for creating flavorful vegan taco filling.,2024-12-16,2025-08-19,2.49,82
1,Heated Throw Blanket,Soft blanket that provides warmth with adjustable settings.,2025-08-30,2025-09-18,49.99,56
1,Spinach Artichoke Dip,"A delicious creamy dip featuring spinach and artichokes, perfect for parties.",2025-03-20,2025-09-14,4.99,59
1,Portable Pet Bathing Tool,Handheld sprayer designed for washing pets easily.,2025-07-10,2025-07-17,29.99,22
1,Chili Lime Corn Chips,Crunchy corn chips flavored with chili and lime for a zesty kick.,2025-02-27,2025-07-30,2.79,71
1,Thai Red Curry Paste,Spicy and flavorful curry paste for authentic Thai dishes.,2025-10-14,2025-09-22,3.99,6
1,Almond Butter Cups,"Rich chocolate cups filled with almond butter, a delicious treat.",2025-06-16,2025-08-19,3.29,18
1,Tailored Blazer,Sharp tailored blazer perfect for office wear and professional events.,2025-01-12,2025-08-17,99.99,56
1,Pumpkin Pancake Mix,Easy-to-make pancake mix with pumpkin spice flavor.,2025-06-24,2025-10-05,4.19,96
1,Coconut Cashew Yogurt,"Creamy yogurt made with coconut and cashews, dairy-free.",2025-09-18,2025-07-10,1.99,5
1,Cable Knit Beanie,A cozy cable knit beanie to keep your head warm in winter.,2025-05-09,2025-07-06,19.99,20
1,Creamy Ranch Dressing,Classic ranch dressing for salads and dipping.,2025-07-26,2025-08-22,2.49,81
1,Juice Extractor,Efficient juicer for fresh fruit and vegetable juices.,2024-11-17,2025-10-07,99.99,1
1,Cotton Quilted Throw Blanket,Cozy throw blanket perfect for adding warmth to your home.,2025-10-26,2025-08-20,39.99,6
1,Organic Cucumber,Fresh organic cucumber perfect for salads or snacking.,2025-03-01,2025-10-05,1.29,69
1,Sesame Oil,Nutty-scented oil for stir-fry and marinades.,2025-09-24,2025-08-09,3.99,71
1,Popcorn Chicken,"Crispy chicken bites, perfect for dipping.",2025-04-13,2025-09-15,6.49,56
1,Backpacking Tent,Lightweight and durable tent for camping trips.,2025-03-23,2025-08-06,109.99,31
1,Mushroom Soup (canned),Creamy soup full of rich mushroom flavor.,2025-03-28,2025-08-08,2.49,51
1,Crispy Potato Tots,"Golden brown potato tots, crispy on the outside and fluffy inside.",2025-06-12,2025-07-11,3.69,5
1,Electric Meat Grinder,Powerful grinder for making sausage and burgers at home.,2025-09-17,2025-11-02,89.99,58
1,Chino Shorts,Classic chino shorts in a versatile color for summer adventures.,2025-03-01,2025-10-31,34.99,22
1,Toilet Paper (12 rolls),Soft and strong toilet paper for everyday use.,2025-08-01,2025-09-08,8.99,31
1,Folding Backpack Chair,Versatile chair that easily folds up for carrying.,2025-09-01,2025-10-17,49.99,73
1,Lentil Soup (canned),Hearty lentil soup for a quick meal.,2025-08-31,2025-10-18,1.99,90
1,Chic Jumpsuit,An elegant jumpsuit that can be dressed up or down.,2024-12-05,,89.99,91
1,Rice Pilaf Mix,Quick and easy rice pilaf mix for side dishes.,2025-03-30,2025-07-29,2.59,95
1,Portable Camping Shower,Convenient shower system for camping and outdoor activities.,2025-07-29,2025-07-11,39.99,98
1,Cinnamon Roll Kit,Everything you need to make melt-in-your-mouth cinnamon rolls at home.,2025-10-29,2025-11-05,6.89,26
1,Adjustable Skipping Rope,Durable skipping rope with adjustable length for workouts.,2025-08-29,2025-07-19,12.99,54
1,Nut Mix,A blend of mixed nuts for snacking.,2025-05-13,2025-09-26,5.99,44
1,Men's Waterproof Hiking Boots,Durable boots designed for outdoor hiking and activities.,2025-08-26,2025-08-12,89.99,68
1,Yoga Mat,Non-slip yoga mat for optimal grip and comfort.,2025-06-02,2025-10-02,25,59
1,Thyme,"Fresh thyme, perfect for seasoning dishes.",2025-07-03,2025-08-28,2.49,87
1,Non-Stick Grill Pan,Heavy-duty grill pan for indoor grilling.,2025-06-03,2025-08-06,39.99,50
1,Coconut Chia Seed Pudding,"Ready-to-eat chia seed pudding made with coconut milk, perfect for breakfast or dessert.",2024-11-20,2025-10-12,2.99,36
1,Pasta Sauce Mix,Just add water for a quick pasta sauce.,2025-04-30,2025-08-19,1.29,82
1,Handmade Leather Wallet,High-quality leather wallet with multiple compartments.,2025-02-17,,49.99,73
1,Electric Stool Heater,Heated stool cover for extra comfort during winter.,2025-03-01,2025-09-05,29.99,98
1,Vegetable Samosas,Crispy pastry filled with seasoned vegetables.,2025-05-29,2025-09-09,4.99,90
1,High-Waisted Skirt,"Chic high-waisted skirt, perfect for professional or casual settings.",2025-06-26,2025-08-26,34.99,49
1,Sweet Potato Fries,"Crispy sweet potato fries, a delicious side dish.",2025-06-16,2025-07-16,3.99,17
1,Travel Pillow with Memory Foam,Ergonomically designed neck pillow for comfortable travel.,2025-07-22,2025-07-28,29.99,87
1,Sculpting Kit,Complete sculpting tools for artists.,2025-06-14,2025-10-20,25.99,38
1,Whole Grain Cereal,"Healthy whole grain cereal, great for breakfast.",2025-03-20,2025-08-16,3.49,57
1,Chocolate Avocado Pudding,Rich and creamy pudding made with ripe avocados and cocoa.,2025-02-02,2025-08-20,4.99,49
1,Adjustable Dog Harness,Comfortable and adjustable harness for dogs.,2025-09-11,2025-09-11,24.99,90
1,Chocolate Chip Cookie Dough,Ready-to-bake cookie dough packed with chocolate chips.,2025-06-22,2025-08-19,5.49,72
1,Classic Cheesecake Mix,"A simple, no-bake cheesecake mix to create your own delicious cheesecake.",2025-10-11,2025-07-30,4.99,49
1,Corn Tortillas,"Soft and warm corn tortillas, perfect for tacos and burritos.",2024-11-10,2025-08-17,2.49,24
1,Mini Meatballs,Frozen mini meatballs that are great as a snack or in pasta dishes.,2025-07-30,2025-08-10,5.99,11
1,Vegetable Stir-Fry Sauce,Savory sauce for vegetable and meat stir-fries.,2025-04-25,2025-07-11,3.49,36
1,Throw Pillow Covers,Set of decorative pillow covers to enhance your home decor.,2025-04-20,2025-09-03,22.99,1
1,Dual Function Electric Skillet,"Skillet that can fry, grill, and sauté with ease.",2024-11-10,2025-07-07,59.99,51
1,Weighted Blanket,Therapeutic weighted blanket for better sleep.,2025-04-18,2025-08-28,79.99,72
1,Collapsible Pet Dog Bowl,Travel-friendly dog bowl that is collapsible for easy storage.,2025-10-20,2025-07-03,9.99,63
1,Smart Plug,Wi-Fi enabled plug for controlling devices from your smartphone.,2025-06-09,2025-08-26,19.99,34
1,Cold Brew Coffee Maker,Brews coffee with a smooth flavor without bitterness.,2025-09-11,2025-07-17,34.99,43
1,Vegetarian Stir Fry Sauce,Flavorful sauce perfect for stir-frying vegetables and tofu.,2025-08-06,2025-10-01,2.49,10
1,Cabbage,"Fresh green cabbage, great for salads and slaws.",2025-10-11,2025-08-19,1.29,62
1,Tomato Paste,"Concentrated tomato paste, great for sauces.",2025-06-03,2025-08-27,1.29,14
1,LED Under Cabinet Lighting,Easy-to-install lights to brighten kitchen cabinets and workspaces.,2025-05-11,2025-08-16,29.99,50
1,Vegetable Curry,A hearty vegetable curry for a quick and satisfying meal.,2025-06-11,2025-09-23,5.99,4
1,Stylish Wireless Earbuds,True wireless earbuds with excellent sound quality.,2024-11-19,2025-10-13,59.99,66
1,Herb Garlic Butter,"A flavorful garlic butter blend, perfect for cooking or baking.",2025-05-02,2025-07-04,3.99,62
1,Chipotle Black Bean Salad,"A zesty salad with black beans, corn, and chipotle dressing.",2025-06-28,2025-09-02,3.29,19
1,Smartphone Photography Ring Light,Portable ring light that enhances your photos with perfect lighting.,2025-04-02,2025-07-13,29.99,80
1,Spicy Vegetable Sushi Rolls,Vegan sushi filled with spicy vegetables and avocado.,2025-07-27,2025-08-02,8.49,48
1,Almond Flour Pancake Mix,Gluten-free pancake mix made with almond flour.,2024-12-04,2025-09-29,5.99,83
1,Motion Sensor Light,Battery-operated motion sensor light for safety.,2024-11-10,2025-07-27,19.99,86
1,Pumpkin Spice Granola,Crunchy granola with pumpkin spice flavor.,2024-11-28,2025-10-16,4.99,42
1,Thyme,"Fresh thyme, perfect for seasoning dishes.",2025-01-11,2025-10-27,2.49,16
1,Habanero Hot Sauce,Fiery hot sauce made with fresh habaneros and spices.,2025-02-15,2025-10-06,3.79,19
1,Pet Grooming Gloves,Gentle grooming gloves for shedding pets.,2025-05-22,2025-07-14,9.99,26
1,Sesame Ginger Dressing,"Tangy dressing perfect for salads and marinades, with sesame and ginger flavors.",2025-08-12,2025-11-04,4.09,80
1,Coconut Cream,"Rich cream extracted from coconut milk, ideal for desserts.",2025-07-27,2025-07-17,2.99,2
1,Luxury Bathrobe,Soft and cozy bathrobe perfect for relaxing at home.,2025-04-21,2025-09-29,49.99,78
1,Peanut Butter Cookies,Soft and chewy cookies made with creamy peanut butter.,2025-04-20,2025-07-20,3.49,66
1,Artisan Bread,,2025-04-06,2025-10-04,4.59,93
1,Italian Sausage Links,Savory sausage links seasoned with Italian spices.,2025-11-03,2025-07-28,5.99,1
1,Slim Fit Chinos,Comfortable slim fit chinos for a polished look.,2025-02-14,2025-10-21,54.99,46
1,Graphic Tee,Soft cotton graphic tee available in various designs.,2025-02-18,2025-07-18,19.99,82
1,Baked Falafel Balls,"Frozen falafel balls made from chickpeas and herbs, perfect for quick meals or salads.",2025-10-01,2025-08-21,5.99,98
1,Collapsible Pet Dog Bowl,Travel-friendly dog bowl that is collapsible for easy storage.,2025-10-21,2025-09-28,9.99,93
1,Radish Chips,"Crispy baked radish chips, a healthy snack alternative.",2025-02-15,2025-10-25,2.89,81
1,Spicy Tuna Salad,"Ready-to-eat tuna salad with a spicy kick, perfect for sandwiches.",2025-10-14,2025-08-14,4.49,71
1,Maple Almond Butter,,2025-08-20,,5.49,20
1,Whole Roasted Chicken,,2025-09-30,2025-07-27,9.99,1
1,Pistachios,"Roasted pistachios, a healthy and tasty snack.",2025-04-29,2025-09-18,6.99,43
1,Puffed Rice Cake,Low-calorie rice cake for snacks.,2025-01-31,2025-10-10,2.49,75
1,Cranberry Lime Sparkling Water,Refreshing sparkling water infused with cranberry and lime flavors.,2024-11-22,2025-09-28,1.5,73
1,Tahini,Creamy tahini made from ground sesame seeds.,2024-12-12,2025-09-17,5.49,21
1,Antique Style Clock,Nostalgic clock that adds charm to any room.,2025-08-18,2025-10-28,39.99,74
1,Baked Mac and Cheese,Creamy macaroni and cheese baked to perfection.,2025-06-03,2025-09-05,5.99,34
1,Butternut Squash Ravioli,"Delicate ravioli filled with roasted butternut squash and spices, perfect with a sage butter sauce.",2025-07-14,2025-08-02,6.29,80
1,Fall-Themed Table Runner,Decorative table runner perfect for autumn gatherings.,2025-07-25,2025-09-17,19.99,90
1,Apple Juice,"Refreshing apple juice, 100% juice with no added sugar.",2025-04-29,2025-09-23,3.29,6
1,Kids Tablet,Durable tablet designed for kids with parental controls.,2025-08-15,2025-09-16,129.99,83
1,Pet Waterer with Filtration,,2024-11-30,2025-08-22,39.99,26
1,Handmade Wooden Utensil Set,Unique handcrafted utensils for cooking and serving.,2025-01-27,2025-09-15,24.99,97
1,Sun-Dried Tomatoes,Dried tomatoes packed with deep flavor for salads and pasta.,2025-05-12,2025-10-13,3.99,68
1,Pet Training Clicker,Simple tool to train your pet with positive reinforcement.,2024-11-23,2025-09-16,5.99,78
1,LED Desk Lamp,Dimmable LED desk lamp with USB charging port.,2025-01-06,2025-10-29,35,47
1,Handcrafted Wooden Jewelry Box,Beautifully crafted jewelry box with compartments for storage.,2024-12-18,2025-08-23,39.99,77
1,Almond Butter Crunch Bar,Nutritious snack bar made with almond butter and protein.,2025-07-18,,1.99,44
1,Baby Monitor,Video baby monitor with night vision.,2025-10-31,2025-10-07,79.99,59
1,Veggie Burger Patties,Delicious veggie burger patties for grilling or frying.,2025-04-07,2025-10-24,5.99,77
1,Lemon Herb Quinoa,"Fluffy quinoa mixed with lemon zest and herbs, a perfect side.",2025-05-20,2025-08-19,3.49,41
1,LED Table Lamp,Modern LED table lamp with touch control.,2025-03-07,2025-09-30,29.99,54
1,Chocolate Coconut Protein Balls,No-bake protein balls with chocolate and coconut flavors.,2025-03-20,2025-08-24,2.99,87
1,Coconut Curry Lentil Soup,"A hearty soup made with lentils, coconut milk, and a blend of spices for a tropical flavor.",2024-12-29,2025-07-29,3.99,36
1,Turmeric Ginger Tea,A soothing tea blend with turmeric and ginger for wellness.,2025-02-16,2025-07-09,3.29,16
1,Cranberry Orange Oatmeal,Instant oatmeal flavored with cranberries and orange zest for breakfast.,2024-12-21,2025-08-22,2.49,68
1,Running Shorts,Lightweight and breathable running shorts for your workouts.,2025-08-27,2025-07-23,34.99,54
1,Applewood Smoked Bacon,Delicious bacon with a rich applewood smoked flavor.,2025-03-13,2025-10-27,6.99,61
1,Savory Snack Mix,"A mix of nuts, pretzels, and crackers, seasoned just right for snacking.",2024-11-15,2025-09-18,4.49,88
1,Maple Bacon Potato Chips,Savory potato chips with a hint of maple sweetness and crispy bacon flavor.,2025-02-08,2025-07-01,2.89,35
1,DIY Organic Gardening Kit,Complete kit for starting your own organic garden.,2025-06-09,2025-09-13,39.99,24
1,Children's Educational Workbook,Activity workbook for early learning and fun.,2025-04-23,2025-10-03,12.99,52
1,Ethical Wool Scarf,A warm and sustainable wool scarf for chilly days.,2025-09-26,2025-07-22,29.99,20
1,Frozen Berry Blend,A mix of frozen berries for smoothies or desserts,2025-05-20,2025-09-20,4.99,38
1,LED Desk Lamp,Dimmable LED desk lamp with USB charging port.,2025-01-18,2025-08-13,35,15
1,Screen Cleaning Kit,Safe cleaning solution and tools for electronics screens.,2024-11-11,2025-10-30,15.99,29
1,Cranberry Lime Sparkling Water,Refreshing sparkling water infused with cranberry and lime flavors.,2025-05-04,2025-09-13,1.5,84
1,Spinach Artichoke Dip,"A delicious creamy dip featuring spinach and artichokes, perfect for parties.",2025-01-13,2025-07-31,4.99,81
1,Lentil Vegetable Stew,"Hearty stew made with lentils and mixed vegetables, vegan-friendly.",2025-04-11,2025-10-31,4.49,9
1,Organic Coconut Sugar,"A natural sweetener made from coconut sap, a healthier alternative to sugar.",2025-03-13,2025-10-09,4.19,55
1,Pumpkin Pie Spice,A blend of spices that brings the taste of fall to your baked goods.,2025-09-19,2025-09-27,2.99,58
1,Spicy Chicken Wings,"Wide range of flavored wings, perfect for parties or casual snacking.",2025-05-03,2025-10-28,9.99,6
1,Garlic Butter Shrimp,"Frozen shrimp sautéed in garlic butter, ready to thaw and serve over pasta or rice.",2025-10-12,2025-11-02,8.99,90
1,Almond Butter Cups,,2025-10-08,2025-10-02,3.29,14
1,Honey Nut Cheerios,Classic cereal made with whole grains and honey.,2025-09-14,2025-10-23,4.29,32
1,Spicy Salsa Verde,"Green salsa with a spicy kick, great for dipping.",2025-04-22,2025-09-24,3.49,21
1,Baked Mac and Cheese,,2025-05-01,,5.99,21
1,Portable Massage Gun,Personal massager for muscle recovery.,2024-12-17,2025-09-28,79.99,26
1,Body Pillow Case,Soft and breathable pillowcase for body pillows.,2024-11-16,2025-07-18,14.99,86
1,Peach Halves (canned),"Sweet peach halves packed in juice, great for desserts.",2025-03-24,2025-09-30,2.49,63
1,Vegetable Potstickers,"Delicious vegetable dumplings, perfect for steaming or frying.",2025-03-30,2025-07-29,5.99,90
1,Weighted Blanket for Adults,A calming blanket that provides gentle pressure for relaxation.,2025-08-25,2025-09-05,59.99,8
1,Smart Light Bulbs,,2025-10-31,2025-07-02,34.99,3
1,Chicken Fajita Kit,All ingredients included for delicious chicken fajitas.,2025-07-25,2025-09-25,8.99,1
1,Green Smoothie Mix,A convenient powder mix combining greens and fruits for smoothies.,2024-12-27,,5.99,12
1,Rechargeable Hand Warmer,,2025-05-14,2025-07-23,22.99,35
1,Vegan Tacos,Frozen vegan tacos filled with plant-based protein and spices.,2025-08-20,2025-09-05,7.49,55
1,Portable USB-C Monitor,Lightweight and slim monitor ideal for dual-screen setups.,2025-02-23,2025-07-01,199.99,6
1,Self-Cleaning Cat Litter Box,Automated litter box that cleans itself after each use.,2025-05-07,2025-09-19,199.99,77
1,Cocktail Shaker and Mixing Glass Set,Complete set for mixing cocktails at home.,2024-11-23,2025-10-22,39.99,46
1,Children's Gardening Set,Fun gardening tools designed specifically for kids.,2025-03-06,2025-10-06,19.99,59
1,Beard Grooming Kit,Everything you need for maintaining a healthy beard.,2025-05-11,2025-08-16,34.99,64
1,Indoor Grill,Electric indoor grill for quick meals.,2025-09-16,2025-07-04,59.99,2
1,Electric Heat Pad,Microwaveable heat pad for soothing muscle aches.,2025-04-26,2025-09-04,24.99,64
1,Garden Vegetable Chips,"Crispy chips made from assorted garden vegetables, lightly salted.",2025-03-19,2025-08-14,3.49,97
1,Floral Wrap Top,A feminine wrap top with a beautiful floral print.,2025-11-04,2025-09-20,49.99,58
1,Spicy BBQ Sauce,A tangy and spicy BBQ sauce that's perfect for grilling.,2025-07-21,,3.99,64
1,Printed Maxi Skirt,A colorful printed maxi skirt for a bohemian look.,2025-06-01,2025-09-25,39.99,16
1,Dog Frisbee Toy,Durable and soft frisbee designed for dogs to play with.,2025-08-25,2025-08-24,10.99,12
1,Watercolor Set,Complete watercolor set with paints and brushes.,2025-05-24,2025-07-05,19.99,83
1,Compact Dishwasher,Countertop dishwasher for small kitchens.,2025-01-05,2025-07-12,299.99,81
1,Fettuccine Alfredo Dinner Kit,Easy meal kit for creamy fettuccine Alfredo.,2024-11-25,2025-08-25,5.49,14
1,Salsa Verde,"Tangy green salsa made with tomatillos, perfect for tacos.",2025-07-18,,3.49,99
1,Curried Lentil Salad,"A hearty salad with lentils, veggies, and curry dressing.",2025-03-22,2025-07-15,4.29,19
1,Non-Stick Baking Sheets,Set of baking sheets for effortless baking.,2025-06-03,2025-09-24,29.99,44
1,Siphon Coffee Maker,,2025-01-09,2025-07-05,49.99,78
1,Lemon Garlic Marinade,"A zesty marinade made with lemon juice and garlic, ideal for chicken or fish.",2025-04-25,2025-10-15,4.29,57
1,Plant Watering Spikes,Automatic watering devices for potted plants.,2025-06-26,2025-07-18,12.99,56
1,Car Windshield Sun Shade,Protects car interior from sun damage and heat.,2025-06-02,2025-07-19,19.99,39
1,Gluten-Free Bread,Soft and tasty gluten-free sandwich bread.,2025-07-27,2025-10-16,5.49,86
1,Bicycle Repair Kit,Essential tools for on-the-go bike maintenance.,2025-05-23,2025-07-14,14.99,58
1,Travel Eye Mask with Ear Plugs,Comfortable eye mask that includes noise-canceling ear plugs.,2025-02-15,2025-07-28,15.99,12
1,Pumpkin Ice Cream,"Seasonal pumpkin ice cream, perfect for fall.",2024-12-06,2025-09-09,4.99,23
1,Honey Almond Granola Bars,Chewy granola bars made with honey and almonds.,2025-09-06,2025-07-12,3.99,32
1,Herb Drying Rack,Mesh drying rack for preserving herbs and flowers.,2024-11-09,2025-09-11,22.99,40
1,Strawberry Rhubarb Jam,"A sweet and tart jam, perfect on toast or in desserts.",2025-04-18,2025-09-23,4.29,30
1,Oatmeal Raisin Cookies,Delicious cookies packed with oats and raisins.,2025-02-21,2025-09-05,3.49,63
1,Dried Cranberries,"Sweet and tart dried cranberries, great for salads and baking.",2025-10-16,2025-07-02,4.29,71
1,Maple Pecan Oatmeal Cookies,Soft oatmeal cookies with maple and pecans.,2025-07-19,2025-10-05,3.99,98
1,Avocado Oil Mayo,,2025-07-01,2025-08-24,5.29,81
1,Italian Sausage Links,Savory sausage links seasoned with Italian spices.,2025-09-28,2025-09-14,5.99,76
1,Fitness Jump Rope,Durable jump rope for cardio workouts.,2024-12-16,2025-07-20,15.99,82
1,Coconut Milk Ice Cream,"Dairy-free ice cream made with coconut milk, creamy and delicious.",2025-07-26,2025-09-25,6.99,94
1,Applewood Smoked Bacon,,2024-12-16,2025-11-02,6.99,75
1,Hair Dryer,,2025-10-30,2025-07-23,39.99,25
1,Electric Pressure Cooker,"Multi-function pressure cooker that can sauté, steam, and slow cook.",2025-07-12,2025-07-29,89.99,65
1,Ski Goggles,Anti-fog ski goggles for winter sports.,2025-04-28,2025-07-19,49.99,38
1,Crispy Potato Tots,"Golden brown potato tots, crispy on the outside and fluffy inside.",2025-07-03,2025-10-05,3.69,52
1,Lentil Vegetable Curry,,2025-08-08,2025-07-24,4.49,93
1,Smartphone Projector Kit,DIY kit to convert your smartphone into a mini projector.,2025-06-16,2025-07-15,24.99,40
1,Noise-Canceling Headphones,High-quality headphones that block out external noise for immersive listening.,2025-08-25,2025-08-27,119.99,90
1,Balsamic Fig Dressing,"A sweet and tangy dressing made with figs and balsamic vinegar, great on salads.",2025-04-17,2025-07-08,3.79,72
1,Peach Preserves,"Sweet and fruity peach preserves, perfect for spreading on toast.",2025-08-20,2025-10-17,3.79,43
1,Fried Rice,"Pre-cooked vegetable fried rice, just heat and serve.",2025-10-21,2025-10-10,4.29,3
1,Self-Inflating Camping Mattress,Comfortable camping mattress that inflates automatically.,2025-09-19,2025-10-15,49.99,81
1,Roasted Vegetable Medley,,2025-01-19,2025-08-05,3.99,41
1,Tahini,Creamy tahini made from ground sesame seeds.,2025-06-19,2025-08-16,5.49,32
1,Cheddar & Bacon Potato Skins,Gourmet potato skins loaded with cheddar cheese and bacon.,2025-08-25,2025-09-11,7.49,29
1,Organic Granola Cereal,,2025-09-07,2025-09-23,5.99,7
1,Beef Taco Skillet,A convenient meal kit for making a delicious beef taco skillet at home.,2025-07-09,2025-10-27,8.49,85
1,Dish Rack,Collapsible dish rack for kitchen countertop use.,2025-01-08,2025-08-31,24.99,22
1,Frozen Mixed Vegetables,"A mix of carrots, peas, and corn, easy to stir-fry.",2025-05-22,2025-08-27,1.99,90
1,Magnetic Puzzle Board,Magnetic puzzle assembly board for kids.,2025-04-21,2025-08-13,24.99,98
1,Protein Bar Variety Pack,A pack of assorted nut and protein bars for a quick energy boost.,2025-01-26,2025-07-26,12.99,19
1,Organic Ramen Noodles,Quick-cooking ramen noodles made with organic wheat.,2025-03-05,2025-10-20,2.89,79
1,Foldable Electric Scooter,Compact electric scooter for commuting and short trips.,2025-02-05,,349.99,28
1,Cilantro Lime Rice,,2024-11-11,2025-11-04,2.99,80
1,Noise-Canceling Earbuds,Wireless earbuds designed for immersive sound experience.,2025-10-11,2025-08-20,79.99,6
1,Pretzel Bites,,2025-07-22,2025-10-27,4.99,92
1,Chic Ankle Strap Heels,Stylish ankle strap heels for a classy look at any event.,2024-11-08,2025-09-16,69.99,89
1,Dishwasher Safe Cutting Board,Eco-friendly cutting board that is safe for dishwashers.,2025-09-07,2025-10-25,22.99,19
1,Savory Oats,"Instant oats with a savory twist, such as herbs and spices.",2025-02-15,2025-08-14,2.49,13
1,Beef Stew Meat,Tender beef chunks for slow-cooked stews.,2024-12-05,2025-10-29,5.99,99
1,Herbed Couscous,Quick-cooking couscous flavored with herbs and spices.,2025-07-29,2025-07-10,2.49,94
1,Berries Medley,"A mix of fresh raspberries, blueberries, and blackberries.",2025-08-27,2025-08-30,6.99,99
1,Vegetable Curry,A hearty vegetable curry for a quick and satisfying meal.,2025-08-16,2025-09-20,5.99,8
1,Puff Pastry,Versatile puff pastry for pies and pastries.,2024-11-09,2025-08-12,5.49,40
1,Spinach Artichoke Dip,"A delicious creamy dip featuring spinach and artichokes, perfect for parties.",2025-01-17,2025-09-13,4.99,8
1,Dog Training Collar,Rechargeable training collar for effective behavior training.,2025-03-09,2025-07-18,39.99,62
1,Lentil Soup,,2025-09-04,2025-10-23,2.49,86
1,Chocolate Chip Pancake Mix,,2025-02-09,2025-08-19,3.99,4
1,Lightweight Rain Jacket,"Water-resistant jacket ideal for outdoor activities, featuring a packable design.",2024-12-14,2025-10-24,79.99,93
1,Organic Spinach,"Fresh organic spinach, great for salads or cooking.",2025-11-01,2025-09-04,2.99,39
